{
  "$schema": "https://json-schema.org/draft/2020-12/schema",
  "properties": {
    "canonical_answer": {
      "type": [
        "string",
        "array",
        "object",
        "boolean"
      ]
    },
    "certificate_generator": {
      "type": [
        "string",
        "array",
        "object",
        "boolean"
      ]
    },
    "certificate_version": {
      "type": [
        "string",
        "array",
        "object",
        "boolean"
      ]
    },
    "designated_cue": {
      "type": [
        "string",
        "array",
        "object",
        "boolean"
      ]
    },
    "dimensional_checks": {
      "type": [
        "string",
        "array",
        "object",
        "boolean"
      ]
    },
    "family_id": {
      "type": [
        "string",
        "array",
        "object",
        "boolean"
      ]
    },
    "governing_equations": {
      "type": [
        "string",
        "array",
        "object",
        "boolean"
      ]
    },
    "governing_law": {
      "type": [
        "string",
        "array",
        "object",
        "boolean"
      ]
    },
    "invariance_checks": {
      "type": [
        "string",
        "array",
        "object",
        "boolean"
      ]
    },
    "invariance_claim": {
      "type": [
        "string",
        "array",
        "object",
        "boolean"
      ]
    },
    "limitations": {
      "type": [
        "string",
        "array",
        "object",
        "boolean"
      ]
    },
    "numeric_spot_checks": {
      "type": [
        "string",
        "array",
        "object",
        "boolean"
      ]
    },
    "relevant_variables": {
      "type": [
        "string",
        "array",
        "object",
        "boolean"
      ]
    },
    "source_template": {
      "type": [
        "string",
        "array",
        "object",
        "boolean"
      ]
    },
    "stated_assumptions": {
      "type": [
        "string",
        "array",
        "object",
        "boolean"
      ]
    },
    "symbolic_derivation": {
      "type": [
        "string",
        "array",
        "object",
        "boolean"
      ]
    },
    "verification_status": {
      "type": [
        "string",
        "array",
        "object",
        "boolean"
      ]
    }
  },
  "required": [
    "family_id",
    "governing_law",
    "governing_equations",
    "relevant_variables",
    "designated_cue",
    "stated_assumptions",
    "symbolic_derivation",
    "canonical_answer",
    "dimensional_checks",
    "invariance_claim",
    "invariance_checks",
    "numeric_spot_checks",
    "certificate_generator",
    "certificate_version",
    "source_template",
    "verification_status",
    "limitations"
  ],
  "type": "object"
}
