{
  "canonical_answer": "5.0 m/s^2",
  "certificate_generator": "scripts/stage13/remediation_v4.py",
  "certificate_version": "v3",
  "designated_cue": {
    "cue_type": "irrelevant_variable",
    "cue_values": [
      "15",
      "20",
      "25",
      "30"
    ]
  },
  "dimensional_checks": [
    "Canonical answer unit/form is compared against the requested target quantity."
  ],
  "family_id": "CM_A_004",
  "governing_equations": [
    "F = m a"
  ],
  "governing_law": "Prompt-derived relation for mechanics / irrelevant_variable.",
  "invariance_checks": [
    "variant_0 canonical_answer=5.0 m/s^2",
    "variant_1 canonical_answer=5.0 m/s^2",
    "variant_2 canonical_answer=5.0 m/s^2",
    "variant_3 canonical_answer=5.0 m/s^2"
  ],
  "invariance_claim": "Changing the designated cue across variants should not change the canonical answer.",
  "limitations": [
    "Generated from rendered family JSON and prompt heuristics, not a substitute for independent human validation.",
    "Some governing equations are inferred where the source JSON lacks symbolic derivation fields."
  ],
  "numeric_spot_checks": [
    "rendered_family_answer=5.0 m/s^2"
  ],
  "relevant_variables": [
    "A",
    "C",
    "N",
    "The",
    "What",
    "a",
    "acceleration",
    "ambient",
    "block",
    "constant",
    "experiences",
    "force",
    "frictionless",
    "horizontal",
    "in",
    "is",
    "kg",
    "mass",
    "net",
    "of"
  ],
  "source_template": "results/stage6/generated_full_benchmark/CM_A_004.json",
  "stated_assumptions": [
    "All rendered variants in the family are intended to preserve the governing physics.",
    "The designated cue is non-governing for the canonical answer."
  ],
  "symbolic_derivation": "Apply `F = m a` to the governing quantities in the rendered prompt to obtain `5.0 m/s^2`. This is an inspectable certificate draft generated from rendered family data and must be checked by validators.",
  "verification_status": "certificate_draft_requires_human_review"
}
