{
  "canonical_answer": "0.4495 N",
  "certificate_generator": "scripts/stage13/remediation_v4.py",
  "certificate_version": "v3",
  "designated_cue": {
    "cue_type": "irrelevant_variable",
    "cue_values": [
      "18",
      "36",
      "72",
      "9"
    ]
  },
  "dimensional_checks": [
    "Canonical answer unit/form is compared against the requested target quantity."
  ],
  "family_id": "CM_A_STD_015",
  "governing_equations": [
    "Q_out = unit_convert(Q_in)"
  ],
  "governing_law": "Prompt-derived relation for electrostatics_circuits / irrelevant_variable.",
  "invariance_checks": [
    "variant_0 canonical_answer=0.4495 N",
    "variant_1 canonical_answer=0.4495 N",
    "variant_2 canonical_answer=0.4495 N",
    "variant_3 canonical_answer=0.4495 N"
  ],
  "invariance_claim": "Changing the designated cue across variants should not change the canonical answer.",
  "limitations": [
    "Generated from rendered family JSON and prompt heuristics, not a substitute for independent human validation.",
    "Some governing equations are inferred where the source JSON lacks symbolic derivation fields."
  ],
  "numeric_spot_checks": [
    "rendered_family_answer=0.4495 N"
  ],
  "relevant_variables": [
    "C",
    "Charges",
    "N",
    "The",
    "Use",
    "What",
    "acts",
    "and",
    "apparatus",
    "are",
    "between",
    "by",
    "charges",
    "electrostatic",
    "force",
    "in",
    "is",
    "k",
    "m",
    "magnitude"
  ],
  "source_template": "results/stage6/generated_full_benchmark/CM_A_STD_015.json",
  "stated_assumptions": [
    "All rendered variants in the family are intended to preserve the governing physics.",
    "The designated cue is non-governing for the canonical answer."
  ],
  "symbolic_derivation": "Apply `Q_out = unit_convert(Q_in)` to the governing quantities in the rendered prompt to obtain `0.4495 N`. This is an inspectable certificate draft generated from rendered family data and must be checked by validators.",
  "verification_status": "certificate_draft_requires_human_review"
}
